city_id,canonical_name,modern_name,lat,lon,region,notes
conakry,Conakry,Conakry,9.5100,-13.7100,africa,Capital of Guinea
niamey,Niamey,Niamey,13.5100,2.1100,africa,Capital of Niger
ndjamena,N'Djamena,N'Djamena,12.1300,15.0600,africa,Capital of Chad
yaounde,Yaounde,Yaounde,3.8500,11.5000,africa,Capital of Cameroon
libreville,Libreville,Libreville,0.4200,9.4700,africa,Capital of Gabon
bangui,Bangui,Bangui,4.3600,18.5600,africa,Capital of the Central African Republic
brazzaville,Brazzaville,Brazzaville,-4.2700,15.2800,africa,Capital of the Republic of the Congo
kampala,Kampala,Kampala,0.3500,32.5800,africa,Capital of Uganda
kigali,Kigali,Kigali,-1.9500,30.0600,africa,Capital of Rwanda
bujumbura,Bujumbura,Bujumbura,-3.3800,29.3600,africa,Largest city of Burundi
lusaka,Lusaka,Lusaka,-15.4200,28.2800,africa,Capital of Zambia
harare,Harare,Harare,-17.8300,31.0500,africa,Capital of Zimbabwe
lilongwe,Lilongwe,Lilongwe,-13.9800,33.7900,africa,Capital of Malawi
maputo,Maputo,Maputo,-25.9700,32.5800,africa,Capital of Mozambique
antananarivo,Antananarivo,Antananarivo,-18.8800,47.5100,africa,Merina royal city and capital of Madagascar
windhoek,Windhoek,Windhoek,-22.5700,17.0800,africa,Capital of Namibia
gaborone,Gaborone,Gaborone,-24.6500,25.9100,africa,Capital of Botswana
johannesburg,Johannesburg,Johannesburg,-26.2000,28.0500,africa,Gold-rush metropolis of South Africa
asmara,Asmara,Asmara,15.3400,38.9300,africa,Italian colonial city and capital of Eritrea
nouakchott,Nouakchott,Nouakchott,18.0900,-15.9800,africa,Capital of Mauritania
cotonou,Cotonou,Cotonou,6.3700,2.4200,africa,Chief city of the Republic of Benin
lome,Lome,Lome,6.1700,1.2300,africa,Capital of Togo
freetown,Freetown,Freetown,8.4800,-13.2300,africa,Freed-slave settlement and capital of Sierra Leone
monrovia,Monrovia,Monrovia,6.3000,-10.8000,africa,Capital of Liberia founded by freed American slaves
canberra,Canberra,Canberra,-35.2800,149.1300,oceania,Purpose-built capital of Australia
sydney,Sydney,Sydney,-33.8700,151.2100,oceania,First British settlement and largest city of Australia
melbourne,Melbourne,Melbourne,-37.8100,144.9600,oceania,Major metropolis of southern Australia
wellington,Wellington,Wellington,-41.2900,174.7800,oceania,Capital of New Zealand
auckland,Auckland,Auckland,-36.8500,174.7600,oceania,Largest city of New Zealand
port-moresby,Port Moresby,Port Moresby,-9.4400,147.1800,oceania,Capital of Papua New Guinea
suva,Suva,Suva,-18.1400,178.4400,oceania,Capital of Fiji
honolulu,Honolulu,Honolulu,21.3100,-157.8600,oceania,Capital of the Kingdom of Hawaii and chief city of Hawaii
wuhan,Wuhan,Wuhan,30.5900,114.3000,china,Trip-city of the Yangtze and cradle of the 1911 revolution
chongqing,Chongqing,Chongqing,29.5600,106.5500,china,Wartime capital of Nationalist China and a vast Yangtze metropolis
tianjin,Tianjin,Tianjin,39.1300,117.2000,china,Treaty port and great northern harbor near Beijing
shenyang,Shenyang,Shenyang,41.8000,123.4300,china,Mukden the early Manchu capital of the Qing
harbin,Harbin,Harbin,45.8000,126.5300,china,Russian railway city of Manchuria
nagoya,Nagoya,Nagoya,35.1800,136.9100,japan,Castle city of the Owari Tokugawa and an industrial metropolis
hiroshima,Hiroshima,Hiroshima,34.3900,132.4600,japan,Castle town destroyed by the atomic bomb in 1945
sapporo,Sapporo,Sapporo,43.0600,141.3500,japan,Capital of Hokkaido settled in the Meiji era
hue,Hue,Hue,16.4600,107.5900,southeast-asia,Capital of the Nguyen dynasty and imperial Vietnam
ho-chi-minh-city,Saigon,Ho Chi Minh City,10.8200,106.6300,southeast-asia,Saigon the southern metropolis of Vietnam
busan,Busan,Busan,35.1800,129.0800,korea,Great southern port of Korea
incheon,Incheon,Incheon,37.4600,126.7100,korea,Port city west of Seoul
chiang-mai,Chiang Mai,Chiang Mai,18.7900,98.9900,southeast-asia,Capital of the Lan Na kingdom of northern Thailand
mandalay,Mandalay,Mandalay,21.9800,96.0800,southeast-asia,Last royal capital of Konbaung Burma
bago,Bago,Bago,17.3400,96.4800,southeast-asia,Pegu the capital of the Mon Hanthawaddy kingdom
ava,Ava,Inwa,21.8500,95.9800,southeast-asia,Inwa the long-time royal capital of Burma
naukratis,Naukratis,Kom Gieif,30.9000,30.5900,egypt-lower,The great Greek emporion in Saite Egypt
emporion,Emporion,Empuries,42.1300,3.1200,iberia,A Phocaean trading emporion on the Iberian coast
pithekoussai,Pithekoussai,Ischia,40.7400,13.9500,italy,The earliest Greek emporion in the west on Ischia
cumae,Cumae,Cuma,40.8500,14.0500,italy,The first Greek colony on the Italian mainland
al-mina,Al-Mina,Al-Mina,36.1000,35.9300,levant-coast,An early Greek-Levantine emporion at the Orontes mouth
trapezus,Trapezus,Trabzon,41.0000,39.7200,anatolia,Milesian Black Sea colony and capital of the Empire of Trebizond
akragas,Akragas,Agrigento,37.3100,13.5800,italy,A wealthy Greek colony of southern Sicily
sybaris,Sybaris,Sibari,39.7100,16.5000,italy,A famously wealthy Achaean colony of Magna Graecia
antioch,Antioch,Antakya,36.2000,36.1600,levant-coast,Seleucid capital and one of the great cities of the Roman and Byzantine East
seleucia,Seleucia,Tell Umar,33.0900,44.5200,mesopotamia-akkad,Eastern capital of the Seleucid Empire on the Tigris
ctesiphon,Ctesiphon,Salman Pak,33.0900,44.5800,mesopotamia-akkad,Capital of the Parthian and Sasanian empires
baghdad,Baghdad,Baghdad,33.3150,44.3660,mesopotamia-akkad,Round-city capital of the Abbasid Caliphate; later capital of Iraq
anyang,Anyang,Anyang,36.1000,114.3500,china,Last capital of the Shang dynasty; source of the oracle bones
changan,Chang'an,Xi'an,34.2700,108.9500,china,Capital of the Han and Tang dynasties; eastern terminus of the Silk Road
luoyang,Luoyang,Luoyang,34.6200,112.4500,china,Ritual center and capital of many dynasties on the Yellow River
kaifeng,Kaifeng,Kaifeng,34.8000,114.3000,china,Capital of the Northern Song; among the largest cities of its day
hangzhou,Hangzhou,Hangzhou,30.2700,120.1500,china,Capital of the Southern Song; Marco Polo's Quinsai
nanjing,Nanjing,Nanjing,32.0600,118.8000,china,Southern capital of many Chinese states; the first Ming capital
beijing,Beijing,Beijing,39.9000,116.4000,china,Yuan Ming Qing and modern capital; the Forbidden City
guangzhou,Guangzhou,Guangzhou,23.1300,113.2600,china,Ancient Canton; China's great southern trade port
angkor,Angkor,Angkor,13.4100,103.8600,southeast-asia,Capital of the Khmer Empire; among the largest preindustrial cities
bagan,Bagan,Bagan,21.1700,94.8600,southeast-asia,Capital of the Pagan Kingdom of Burma; a city of temples
ayutthaya,Ayutthaya,Ayutthaya,14.3500,100.5700,southeast-asia,Capital of the Siamese kingdom of Ayutthaya
palembang,Palembang,Palembang,-2.9900,104.7600,southeast-asia,Capital of the maritime empire of Srivijaya on Sumatra
thanglong,Thang Long,Hanoi,21.0300,105.8500,southeast-asia,Capital of Dai Viet; the future Hanoi
malacca,Malacca,Melaka,2.1900,102.2500,southeast-asia,Capital of the Malacca Sultanate; a great trade emporium
karakorum,Karakorum,Kharkhorin,47.2000,102.8300,steppe,Capital of the Mongol Empire under Ogedei Khan
samarkand,Samarkand,Samarkand,39.6500,66.9600,steppe,Sogdian Silk Road city; capital of the Timurid Empire
bukhara,Bukhara,Bukhara,39.7700,64.4200,steppe,Silk Road city and capital of the Samanid Empire
merv,Merv,Mary,37.6600,62.1900,steppe,Great Silk Road oasis city; annihilated by the Mongols
sarai,Sarai,Selitrennoye,48.5000,45.0000,steppe,Capital of the Golden Horde on the Volga
nara,Nara,Nara,34.6800,135.8000,japan,First permanent imperial capital of Japan (Heijo-kyo)
kyoto,Kyoto,Kyoto,35.0100,135.7700,japan,Imperial capital of Japan for over a millennium (Heian-kyo)
kamakura,Kamakura,Kamakura,35.3200,139.5500,japan,Seat of the first shogunate
edo,Edo,Tokyo,35.6800,139.6500,japan,Tokugawa shogunal seat then imperial capital; modern Tokyo
osaka,Osaka,Osaka,34.6900,135.5000,japan,Ancient Naniwa; a great merchant city and port
aksum,Aksum,Axum,14.1300,38.7200,africa,Capital of the Aksumite Empire; an early Christian trading power
djenne,Djenne,Djenne,13.9000,-4.5500,africa,Among the oldest urban sites in sub-Saharan Africa; a Niger trade city
timbuktu,Timbuktu,Timbuktu,16.7700,-3.0100,africa,Saharan trade and learning city of the Mali and Songhai empires
gao,Gao,Gao,16.2700,-0.0400,africa,Capital of the Songhai Empire on the Niger
ife,Ife,Ile-Ife,7.4700,4.5600,africa,Holy city of the Yoruba; famed for its bronze and terracotta heads
benin,Benin City,Benin City,6.3400,5.6200,africa,Capital of the Kingdom of Benin; its walls and bronzes
zimbabwe,Great Zimbabwe,Great Zimbabwe,-20.2700,30.9300,africa,Stone capital of the Kingdom of Zimbabwe
kilwa,Kilwa,Kilwa Kisiwani,-8.9600,39.5100,africa,Swahili coast sultanate and Indian Ocean trade hub
kongo,Mbanza Kongo,Mbanza-Kongo,-6.2700,14.2400,africa,Capital of the Kingdom of Kongo
caral,Caral,Caral,-10.8900,-77.5200,americas,The oldest known city in the Americas (Norte Chico)
teotihuacan,Teotihuacan,Teotihuacan,19.6900,-98.8400,americas,The greatest city of ancient Mesoamerica
tikal,Tikal,Tikal,17.2200,-89.6200,americas,A great Classic Maya city-state
monte-alban,Monte Alban,Monte Alban,17.0400,-96.7700,americas,Zapotec capital in the Oaxaca valley
chichen-itza,Chichen Itza,Chichen Itza,20.6800,-88.5700,americas,Maya-Toltec city of the northern Yucatan
tenochtitlan,Tenochtitlan,Mexico City,19.4300,-99.1300,americas,Capital of the Aztec Empire; the future Mexico City
cusco,Cusco,Cusco,-13.5300,-71.9700,americas,Capital of the Inca Empire
cahokia,Cahokia,Cahokia,38.6600,-90.0600,americas,Largest pre-Columbian city north of Mexico
prague,Prague,Prague,50.0900,14.4200,europe-central,Capital of Bohemia and a seat of the Holy Roman Empire
vienna,Vienna,Vienna,48.2100,16.3700,europe-central,Habsburg capital and a bulwark against the Ottomans
krakow,Krakow,Krakow,50.0600,19.9400,europe-central,Royal capital of medieval Poland
buda,Buda,Budapest,47.5000,19.0400,europe-central,Capital of the kingdom of Hungary
kiev,Kiev,Kyiv,50.4500,30.5200,europe-east,Capital of Kievan Rus; sacked by the Mongols
novgorod,Novgorod,Veliky Novgorod,58.5200,31.2700,europe-east,Merchant republic of the medieval Russian north
moscow,Moscow,Moscow,55.7500,37.6200,europe-east,Capital of the Tsardom of Russia and modern Russia
venice,Venice,Venice,45.4400,12.3300,italy,Maritime republic that dominated Mediterranean trade
florence,Florence,Florence,43.7700,11.2500,italy,Banking city and cradle of the Renaissance
palermo,Palermo,Palermo,38.1200,13.3600,italy,Capital of Arab and then Norman Sicily
pompeii,Pompeii,Pompei,40.7500,14.4900,italy,Roman town buried by Vesuvius in 79 CE
granada,Granada,Granada,37.1800,-3.6000,iberia,Last Muslim capital in Iberia; the Alhambra
seville,Seville,Seville,37.3900,-5.9900,iberia,Almohad capital and later a Castilian metropolis
lisbon,Lisbon,Lisbon,38.7200,-9.1400,iberia,Capital of Portugal and its seaborne empire
pergamon,Pergamon,Bergama,39.1300,27.1800,anatolia,Capital of the Attalid kingdom; bequeathed to Rome
konya,Konya,Konya,37.8700,32.4800,anatolia,Capital of the Seljuk Sultanate of Rum
nicaea,Nicaea,Iznik,40.4300,29.7200,anatolia,Site of the church councils; a Byzantine imperial refuge
rhodes,Rhodes,Rhodes,36.4400,28.2200,greece,Hellenistic naval power; the Colossus
aachen,Aachen,Aachen,50.7800,6.0800,germania,Charlemagne's capital and Carolingian heart
thanjavur,Thanjavur,Thanjavur,10.7900,79.1400,india,Capital of the Chola Empire; the great Brihadeeswara temple
vijayanagara,Vijayanagara,Hampi,15.3400,76.4600,india,Capital of the Vijayanagara Empire of southern India
lahore,Lahore,Lahore,31.5800,74.3300,india,A great Mughal capital on the Punjab
mumbai,Mumbai,Mumbai,19.0800,72.8800,india,Colonial Bombay grown into a modern megacity
quanzhou,Quanzhou,Quanzhou,24.8700,118.6800,china,Zaitun; the great medieval port of maritime China
shanghai,Shanghai,Shanghai,31.2300,121.4700,china,Treaty port grown into the largest Chinese city
sukhothai,Sukhothai,Sukhothai,17.0200,99.7000,southeast-asia,First Thai kingdom before Ayutthaya
vijaya,Vijaya,Binh Dinh,13.9300,109.1100,southeast-asia,Capital of the Cham kingdom of Champa
manila,Manila,Manila,14.6000,120.9800,southeast-asia,Spanish colonial capital of the Philippines
tabriz,Tabriz,Tabriz,38.0800,46.2900,steppe,Capital of the Ilkhanate and later Iranian dynasties
balkh,Balkh,Balkh,36.7600,66.9000,steppe,Ancient Bactria; mother of cities on the Silk Road
herat,Herat,Herat,34.3500,62.2000,steppe,Timurid cultural capital of Khorasan
kano,Kano,Kano,12.0000,8.5200,africa,Hausa city-state and trans-Saharan trade hub
mogadishu,Mogadishu,Mogadishu,2.0400,45.3400,africa,Medieval Swahili-Somali trade city on the Indian Ocean
tiwanaku,Tiwanaku,Tiwanaku,-16.5500,-68.6700,americas,Andean ceremonial capital by Lake Titicaca
chan-chan,Chan Chan,Chan Chan,-8.1100,-79.0700,americas,Capital of the Chimu; the largest adobe city in the Americas
tula,Tula,Tula,20.0600,-99.3400,americas,Capital of the Toltecs
lima,Lima,Lima,-12.0500,-77.0400,americas,Capital of Spanish Peru and modern Peru
dunhuang,Dunhuang,Dunhuang,40.1400,94.6600,china,Silk Road oasis and the Mogao Buddhist caves
kashgar,Kashgar,Kashgar,39.4700,75.9900,china,Westernmost Silk Road city of the Tarim Basin
turpan,Turpan,Turpan,42.9500,89.1800,china,The Gaochang oasis on the northern Silk Road
khotan,Khotan,Hotan,37.1100,79.9300,china,Southern Tarim kingdom famed for jade and early Buddhism
kucha,Kucha,Kuqa,41.7200,82.9600,china,Tocharian Buddhist kingdom of the northern Tarim
otrar,Otrar,Otrar,42.8500,68.3000,steppe,Syr Darya trade city; spark of the Mongol invasion
nishapur,Nishapur,Nishapur,36.2100,58.8000,steppe,Great city of Khorasan; annihilated by the Mongols
urgench,Urgench,Konye-Urgench,42.3300,59.1500,steppe,Capital of Khwarezm on the Amu Darya
tashkent,Tashkent,Tashkent,41.3100,69.2800,steppe,Silk Road city of Chach; modern capital of Uzbekistan
cairo,Cairo,Cairo,30.0400,31.2400,egypt-lower,Fustat then Cairo; Fatimid Mamluk and modern Egyptian capital
fez,Fez,Fes,34.0300,-5.0000,north-africa,Idrisid and Marinid capital of Morocco; the Qarawiyyin
marrakesh,Marrakesh,Marrakesh,31.6300,-8.0100,north-africa,Almoravid Almohad and Saadi capital of Morocco
volubilis,Volubilis,Volubilis,34.0700,-5.5500,north-africa,Roman city of Mauretania Tingitana
sijilmasa,Sijilmasa,Rissani,31.2800,-4.2800,north-africa,Saharan gateway of the West African gold trade
kairouan,Kairouan,Kairouan,35.6800,10.1000,north-africa,First Arab city in the Maghreb; Aghlabid capital and holy city
tunis,Tunis,Tunis,36.8000,10.1800,north-africa,Hafsid capital that succeeded Carthage; modern Tunisia
cirta,Cirta,Constantine,36.3600,6.6100,north-africa,Numidian royal capital; later Roman Constantine
tlemcen,Tlemcen,Tlemcen,34.8800,-1.3100,north-africa,Capital of the Zayyanid kingdom of the central Maghreb
algiers,Algiers,Algiers,36.7500,3.0600,north-africa,Ottoman corsair capital; modern Algeria
tripoli,Tripoli,Tripoli,32.8900,13.1900,north-africa,Ancient Oea; Ottoman and modern Libyan capital
niani,Niani,Niani,11.3900,-8.4000,africa,Capital of the Mali Empire under Mansa Musa
koumbi,Koumbi Saleh,Koumbi Saleh,15.7700,-8.0000,africa,Capital of the Ghana Empire; first of the great Sahel states
mombasa,Mombasa,Mombasa,-4.0500,39.6600,africa,Swahili port city of the East African coast
zanzibar,Zanzibar,Zanzibar City,-6.1600,39.1900,africa,Stone Town; capital of the Omani sultanate of Zanzibar
sofala,Sofala,Nova Sofala,-20.1700,34.7300,africa,Gold-trade port linking Great Zimbabwe to the Indian Ocean
gondar,Gondar,Gondar,12.6000,37.4700,africa,Imperial capital of Ethiopia; the castles of the Solomonic kings
harar,Harar,Harar,9.3100,42.1200,africa,Walled Islamic trading city of the Horn
lalibela,Lalibela,Lalibela,12.0300,39.0400,africa,Zagwe capital of Ethiopia; the rock-hewn churches
luanda,Luanda,Luanda,-8.8400,13.2300,africa,Portuguese Atlantic trade port; modern capital of Angola
delphi,Delphi,Delphi,38.4800,22.5000,greece,Pan-Hellenic sanctuary and oracle of Apollo
olympia,Olympia,Olympia,37.6400,21.6300,greece,Sanctuary of Zeus and home of the Olympic Games
pylos,Pylos,Pylos,36.9100,21.7000,greece,Mycenaean palace of Nestor on the Bay of Navarino
larissa,Larissa,Larissa,39.6400,22.4200,greece,Chief city of Thessaly; continuously inhabited
eretria,Eretria,Eretria,38.4000,23.7900,greece,Euboean trading city and early Greek colonizer
new-york,New York,New York,40.7100,-74.0100,americas,New Amsterdam then New York; the great American metropolis
washington,Washington,Washington,38.9000,-77.0400,americas,Capital of the United States
boston,Boston,Boston,42.3600,-71.0600,americas,Puritan city and cradle of the American Revolution
quebec,Quebec,Quebec City,46.8100,-71.2100,americas,Capital of New France; gateway to Canada
havana,Havana,Havana,23.1100,-82.3700,americas,Spanish Caribbean stronghold; capital of Cuba
chengdu,Chengdu,Chengdu,30.6600,104.0700,china,Capital of Shu; a great city of the Sichuan basin
xingqing,Xingqing,Yinchuan,38.4900,106.2300,china,Capital of Western Xia; modern Yinchuan
datong,Datong,Datong,40.0900,113.3000,china,Pingcheng; capital of the Northern Wei and a Liao western capital
liaoyang,Liaoyang,Liaoyang,41.2700,123.1800,china,Eastern capital of the Liao in the northeast
dading,Dading,Ningcheng,41.6000,119.4000,china,Central capital of the Jurchen Jin
hongkong,Hong Kong,Hong Kong,22.3200,114.1700,china,British colonial port returned to China
avarga,Avarga,Avarga,47.2000,109.0000,steppe,Genghis Khan's base camp; the Mongol Empire's first seat
hedeby,Hedeby,Hedeby,54.4900,9.5600,northern-europe,Great Viking-age trade emporium of the Danes
birka,Birka,Bjorko,59.3400,17.5400,northern-europe,Viking-age trading town of the Swedes
dublin,Dublin,Dublin,53.3500,-6.2600,northern-europe,Norse longphort that became the capital of Ireland
madrid,Madrid,Madrid,40.4200,-3.7000,iberia,Castilian fortress town that became the capital of Spain
peshawar,Purushapura,Peshawar,34.0080,71.5785,india,Kushan capital of Gandhara guarding the Khyber Pass
multan,Multan,Multan,30.1980,71.4710,india,Ancient Indus city of the sun temple and later Sufi shrines
kanchipuram,Kanchipuram,Kanchipuram,12.8350,79.7040,india,Pallava capital and great temple city of the Tamil country
anuradhapura,Anuradhapura,Anuradhapura,8.3114,80.4037,india,The ancient Buddhist royal capital of Sri Lanka
hyderabad,Hyderabad,Hyderabad,17.3850,78.4867,india,Qutb Shahi foundation and seat of the Nizams of the Deccan
surat,Surat,Surat,21.1700,72.8310,india,Great Mughal port of Gujarat and early European trading hub
amritsar,Amritsar,Amritsar,31.6340,74.8723,india,Holy city of the Sikhs and seat of the Golden Temple
chennai,Madras,Chennai,13.0827,80.2707,india,British Fort St George that grew into a southern metropolis
rey,Rhages,Ray,35.5900,51.4300,iran-zagros,Ancient Median city near modern Tehran razed by the Mongols
aden,Aden,Aden,12.7900,45.0300,arabia,Great natural harbor and trading port of southern Arabia
gaza,Gaza,Gaza,31.5000,34.4700,levant-inland,Ancient Canaanite and Philistine city on the coastal road
izmir,Smyrna,Izmir,38.4200,27.1400,anatolia,Ionian Greek port and great city of the Aegean coast
acre,Akko,Acre,32.9200,35.0700,levant-coast,Phoenician port and chief stronghold of the Crusader kingdom
suzhou,Suzhou,Suzhou,31.2990,120.5850,china,Canal city of the lower Yangtze famed for gardens and silk
ningbo,Ningbo,Ningbo,29.8680,121.5440,china,Great port of Zhejiang on the East China Sea
taiyuan,Taiyuan,Taiyuan,37.8700,112.5500,china,Fortress city of Shanxi long guarding the northern frontier
fuzhou,Fuzhou,Fuzhou,26.0740,119.2960,china,Maritime trade capital of Fujian
nagasaki,Nagasaki,Nagasaki,32.7500,129.8770,japan,Port that was Japan's window on the world during the closed centuries
kanazawa,Kanazawa,Kanazawa,36.5610,136.6560,japan,Castle town of the powerful Maeda domain
kagoshima,Kagoshima,Kagoshima,31.5970,130.5570,japan,Castle town of the Shimazu lords of Satsuma
sendai,Sendai,Sendai,38.2680,140.8690,japan,Castle town of the Date domain of the northeast
jeonju,Jeonju,Jeonju,35.8240,127.1480,korea,Ancestral seat of the Joseon royal house
daegu,Daegu,Daegu,35.8710,128.6010,korea,Inland commercial city of the Korean southeast
hamhung,Hamhung,Hamhung,39.9180,127.5360,korea,Northeastern city and a base of the early Joseon founders
surabaya,Surabaya,Surabaya,-7.2580,112.7520,southeast-asia,Great port of eastern Java
luang-prabang,Luang Prabang,Luang Prabang,19.8860,102.1350,southeast-asia,Royal capital of the Lao kingdom of Lan Xang
makassar,Makassar,Makassar,-5.1480,119.4320,southeast-asia,Spice-trade port and seat of the Gowa sultanate on Sulawesi
cebu,Cebu,Cebu,10.3160,123.8850,southeast-asia,Visayan trading port and the first Spanish foothold in the Philippines
oc-eo,Oc Eo,Oc Eo,10.2300,105.1500,southeast-asia,Great port of the Funan kingdom in the Mekong delta
maragheh,Maragheh,Maragheh,37.3900,46.2400,iran-zagros,First Ilkhanid capital and site of Nasir al-Din al-Tusi's observatory
sultaniyya,Sultaniyya,Soltaniyeh,36.4300,48.7950,iran-zagros,Ilkhanid capital of Oljaitu famed for its great dome
almaliq,Almaliq,Almalik,43.9000,81.3000,steppe,Capital of the Chagatai Khanate in the Ili valley
shangdu,Shangdu,Xanadu,42.3580,116.1800,china,Kublai Khan's summer capital; Marco Polo's Xanadu
bolghar,Bolghar,Bolgar,54.9800,49.0300,steppe,Capital of Volga Bulgaria and an early Golden Horde seat
astrakhan,Astrakhan,Astrakhan,46.3500,48.0400,steppe,Lower-Volga city of the Golden Horde and its successor khanate
caffa,Caffa,Feodosia,45.0300,35.3800,pontic-steppe,Genoese Black Sea trade colony in the Golden Horde sphere
vladimir,Vladimir,Vladimir,56.1300,40.4000,europe-east,Senior Rus principality under the Golden Horde yoke
carchemish,Carchemish,Karkamis,36.8300,38.0100,levant-inland,Bronze Age city and Hittite viceroyalty on the Euphrates
tushpa,Tushpa,Van,38.5000,43.4000,anatolia,Capital of the kingdom of Urartu by Lake Van
samaria,Samaria,Sebastia,32.2800,35.1900,levant-inland,Capital of the kingdom of Israel; rebuilt by Herod as Sebaste
tarsus,Tarsus,Tarsus,36.9200,34.8950,anatolia,Cilician city of Hittite Kizzuwatna and birthplace of St Paul
nicomedia,Nicomedia,Izmit,40.7650,29.9400,anatolia,Bithynian capital and Diocletian's eastern Roman capital
hazor,Hazor,Tel Hazor,33.0170,35.5680,levant-inland,Largest Canaanite city-state; later destroyed by Assyria
hegra,Hegra,Mada'in Salih,26.7900,37.9500,arabia,Second city of the Nabataeans with rock-cut tombs on the incense road
dadan,Dadan,Al-Ula,26.6160,37.9200,arabia,Capital of the Dadanite and Lihyanite kingdoms of northwest Arabia
tayma,Tayma,Tayma,27.6300,38.4800,arabia,Ancient oasis where the Babylonian king Nabonidus resided a decade
marib,Marib,Marib,15.4200,45.3300,arabia,Capital of Saba and site of the Great Dam
shabwa,Shabwa,Shabwa,15.3700,47.0100,arabia,Capital of the Hadramawt kingdom on the incense route
sohar,Sohar,Sohar,24.3500,56.7100,arabia,Great medieval Omani port and gateway of Indian Ocean trade
mleiha,Mleiha,Mleiha,25.1300,55.8500,arabia,Pre-Islamic caravan center of the Oman peninsula
najran,Najran,Najran,17.4900,44.1300,arabia,Oasis of the Christian martyrs on the Yemeni frontier
qaryat-al-faw,Qaryat al-Faw,Qaryat al-Faw,19.7500,45.1800,arabia,Caravan capital of the kingdom of Kindah
dvin,Dvin,Dvin,40.0000,44.5800,caucasus,Long-time capital of medieval Armenia
ani,Ani,Ani,40.5070,43.5720,caucasus,Bagratid Armenian capital famed as the city of a thousand churches
derbent,Derbent,Derbent,42.0600,48.2900,caucasus,The Caspian Gates; Sasanian wall-fortress guarding the steppe
chavin,Chavin de Huantar,Chavin,-9.5900,-77.1800,americas,The great early Andean religious center
cajamarca,Cajamarca,Cajamarca,-7.1600,-78.5100,americas,Andean highland city where Pizarro seized the Inca Atahualpa
pachacamac,Pachacamac,Pachacamac,-12.2600,-76.9000,americas,Great coastal oracle and pilgrimage center near Lima
palenque,Palenque,Palenque,17.4830,-92.0460,americas,Classic Maya city of Pakal in the western lowlands
calakmul,Calakmul,Calakmul,18.1050,-89.8110,americas,Maya superpower and great rival of Tikal
copan,Copan,Copan,14.8400,-89.1400,americas,Classic Maya capital of the southeast and its sculpture
sri-ksetra,Sri Ksetra,Pyay,18.8100,95.2900,southeast-asia,Greatest of the Pyu city-states of early Burma
yogyakarta,Yogyakarta,Yogyakarta,-7.8000,110.3600,southeast-asia,Heart of the Medang and Mataram kingdoms; Borobudur and Prambanan
kedah,Kedah,Kedah,6.1200,100.3700,southeast-asia,Ancient Indianized port of the Bujang Valley on the Malay isthmus
indrapura,Indrapura,Dong Duong,15.7800,108.3400,southeast-asia,Northern capital of Champa near the Cham temples of My Son
mashhad,Mashhad,Mashhad,36.3000,59.6100,iran-zagros,Great Khorasan city grown around the shrine of Imam Reza
yazd,Yazd,Yazd,31.9000,54.3700,iran-zagros,Desert oasis and stronghold of Zoroastrian Persia
qom,Qom,Qom,34.6400,50.8800,iran-zagros,Shia holy city of the shrine of Fatima Masumeh
qazvin,Qazvin,Qazvin,36.2700,50.0000,iran-zagros,A Safavid capital before the move to Isfahan
khiva,Khiva,Khiva,41.3800,60.3600,steppe,Khwarezm oasis and capital of the Khanate of Khiva
kokand,Kokand,Kokand,40.5200,70.9400,steppe,Capital of the Khanate of Kokand in the Fergana valley
termez,Termez,Termez,37.2200,67.2800,steppe,Ancient Oxus city and Buddhist center of Bactria
zafar,Zafar,Zafar,14.2100,44.4000,arabia,Highland capital of the Himyarite kingdom
timna,Timna,Timna,15.0000,45.8500,arabia,Capital of the incense kingdom of Qataban
qana,Qana,Bir Ali,14.0000,48.3000,arabia,Frankincense port of the Hadramawt kingdom
sirwah,Sirwah,Sirwah,15.4300,45.0000,arabia,Early capital of Saba west of Marib
benin-city,Benin City,Benin City,6.3400,5.6200,africa,Walled capital of the Kingdom of Benin famed for its bronzes
mapungubwe,Mapungubwe,Mapungubwe,-22.1900,29.3900,africa,First great kingdom of southern Africa before Great Zimbabwe
nan-madol,Nan Madol,Nan Madol,6.8420,158.3340,oceania,Megalithic island capital of the Saudeleur dynasty of Pohnpei
